{
  "schemaVersion": "quest-pack.v0",
  "id": "merge-two-sorted-lists",
  "slug": "merge-two-sorted-lists",
  "title": "Merge Two Sorted Lists: Twin Portal Chains",
  "status": "validated",
  "metadata": {
    "difficulty": "easy",
    "originalTextConfirmed": true,
    "authors": [
      "Eric Weng",
      "Hermes"
    ],
    "createdAt": "2026-10-01T00:00:00.000Z",
    "updatedAt": "2026-10-01T00:00:00.000Z",
    "displayName": "Merge Two Sorted Lists",
    "shortDescription": "Merge two sorted portal chains into one stable route.",
    "sourceInspiredBy": "Merge Two Sorted Lists: Twin Portal Chains"
  },
  "story": {
    "worldName": "Portal Islands",
    "premise": "Each node is an island connected by one-way portals.",
    "playerRole": "Portal mapper",
    "dataMetaphor": "islands",
    "targetMetaphor": "target island",
    "readMetaphor": "portal check",
    "victoryText": "The island chain stabilizes.",
    "failureText": "The portals point somewhere unexpected. Replay the walk."
  },
  "concepts": [
    "linked_list"
  ],
  "runtime": {
    "language": "python",
    "signature": "class Solution:\n    def mergeTwoLists(self, list1: Optional[ListNode], list2: Optional[ListNode]) -> Optional[ListNode]:",
    "entrypoint": "Solution().mergeTwoLists",
    "importsAllowed": [],
    "timeLimitMs": 2000,
    "timelineEventCap": 3000
  },
  "scene": {
    "type": "linked_list",
    "renderer": "linked-list-portals-v0",
    "smallInputMode": "islands",
    "largeInputMode": "portal-chain",
    "visualTokens": {
      "node": "island",
      "next": "portal",
      "read": "map-check"
    },
    "trackedVariables": [
      "head",
      "prev",
      "curr",
      "next",
      "slow",
      "fast",
      "list1",
      "list2"
    ],
    "outcomeVisuals": {
      "passed": "portal_chain_glow",
      "wrong_answer": "red_chain_green_expected",
      "compile_error": "broken_scroll",
      "runtime_error": "portal_sparks",
      "over_budget": "frayed_map_meter",
      "loop_guard": "endless_portal_spin",
      "off_end_read": "void_portal_fall"
    }
  },
  "quests": [
    {
      "id": "compare-heads",
      "order": 1,
      "title": "Quest 1: Compare first islands",
      "brief": "Return the smaller first value.",
      "learningGoal": "Practice linked-list pointer movement.",
      "signature": "def smaller_head(list1: Optional[ListNode], list2: Optional[ListNode]) -> int:",
      "entrypoint": "smaller_head",
      "starterCode": "def smaller_head(list1: Optional[ListNode], list2: Optional[ListNode]) -> int:\n    pass\n",
      "hints": [
        {
          "id": "h1",
          "text": "Which pointer changes first?",
          "cost": "free"
        },
        {
          "id": "h2",
          "text": "What should be saved before rewiring next?",
          "cost": "reduces_reward"
        }
      ],
      "solution": {
        "code": "def smaller_head(list1: Optional[ListNode], list2: Optional[ListNode]) -> int:\n    if list1.val <= list2.val:\n        return list1.val\n    return list2.val\n",
        "explanation": "Walk the portal chain while keeping pointer state explicit.",
        "complexity": {
          "time": "O(n)",
          "space": "O(1)"
        }
      },
      "tests": {
        "fixed": [
          {
            "id": "smaller",
            "input": {
              "list1": [
                1,
                4
              ],
              "list2": [
                2,
                3
              ]
            },
            "expected": 1
          }
        ],
        "replayCaseIds": [
          "smaller"
        ]
      },
      "budget": {
        "enabled": false,
        "unit": "node_read",
        "failureMode": "badge_only"
      },
      "unlock": {
        "requiresQuestIds": [],
        "requiresPassed": true
      },
      "rewards": {
        "xp": 20
      }
    },
    {
      "id": "append-tail",
      "order": 2,
      "title": "Quest 2: Attach the remaining chain",
      "brief": "Return the non-empty chain values.",
      "learningGoal": "Practice linked-list pointer movement.",
      "signature": "def remaining(head: Optional[ListNode]) -> Optional[ListNode]:",
      "entrypoint": "remaining",
      "starterCode": "def remaining(head: Optional[ListNode]) -> Optional[ListNode]:\n    pass\n",
      "hints": [
        {
          "id": "h1",
          "text": "Which pointer changes first?",
          "cost": "free"
        },
        {
          "id": "h2",
          "text": "What should be saved before rewiring next?",
          "cost": "reduces_reward"
        }
      ],
      "solution": {
        "code": "def remaining(head: Optional[ListNode]) -> Optional[ListNode]:\n    if head:\n        _ = head.val\n    return head\n",
        "explanation": "Walk the portal chain while keeping pointer state explicit.",
        "complexity": {
          "time": "O(n)",
          "space": "O(1)"
        }
      },
      "tests": {
        "fixed": [
          {
            "id": "remain",
            "input": {
              "head": [
                3,
                4,
                5
              ]
            },
            "expected": [
              3,
              4,
              5
            ]
          }
        ],
        "replayCaseIds": [
          "remain"
        ]
      },
      "budget": {
        "enabled": false,
        "unit": "node_read",
        "failureMode": "badge_only"
      },
      "unlock": {
        "requiresQuestIds": [
          "compare-heads"
        ],
        "requiresPassed": true
      },
      "rewards": {
        "xp": 20
      }
    }
  ],
  "boss": {
    "id": "boss-merge-two-lists",
    "order": 1,
    "title": "Boss: Merge Twin Portal Chains",
    "brief": "Merge two sorted island chains.",
    "learningGoal": "Practice linked-list pointer movement.",
    "signature": "class Solution:\n    def mergeTwoLists(self, list1: Optional[ListNode], list2: Optional[ListNode]) -> Optional[ListNode]:",
    "entrypoint": "Solution().mergeTwoLists",
    "starterCode": "class Solution:\n    def mergeTwoLists(self, list1: Optional[ListNode], list2: Optional[ListNode]) -> Optional[ListNode]:\n        pass\n",
    "hints": [
      {
        "id": "h1",
        "text": "Which pointer changes first?",
        "cost": "free"
      },
      {
        "id": "h2",
        "text": "What should be saved before rewiring next?",
        "cost": "reduces_reward"
      }
    ],
    "solution": {
      "code": "class Solution:\n    def mergeTwoLists(self, list1: Optional[ListNode], list2: Optional[ListNode]) -> Optional[ListNode]:\n        dummy = ListNode(0)\n        tail = dummy\n        while list1 and list2:\n            if list1.val <= list2.val:\n                tail.next = list1\n                list1 = list1.next\n            else:\n                tail.next = list2\n                list2 = list2.next\n            tail = tail.next\n        tail.next = list1 or list2\n        return dummy.next\n",
      "explanation": "Walk the portal chain while keeping pointer state explicit.",
      "complexity": {
        "time": "O(n)",
        "space": "O(1)"
      }
    },
    "tests": {
      "fixed": [
        {
          "id": "merge-basic",
          "input": {
            "list1": [
              1,
              2,
              4
            ],
            "list2": [
              1,
              3,
              4
            ]
          },
          "expected": [
            1,
            1,
            2,
            3,
            4,
            4
          ]
        },
        {
          "id": "merge-empty",
          "input": {
            "list1": [],
            "list2": [
              0
            ]
          },
          "expected": [
            0
          ]
        }
      ],
      "replayCaseIds": [
        "merge-basic"
      ]
    },
    "budget": {
      "enabled": false,
      "unit": "node_read",
      "failureMode": "badge_only"
    },
    "unlock": {
      "requiresQuestIds": [
        "compare-heads",
        "append-tail"
      ],
      "requiresPassed": true
    },
    "rewards": {
      "xp": 20
    }
  },
  "review": {
    "enabled": true,
    "defaultSchedule": [
      1,
      3,
      7,
      14,
      30
    ],
    "variants": [],
    "rules": {
      "failedReviewIntervalDays": 1,
      "solutionAssistedIntervalDays": 1,
      "heavyHintMaxIntervalDays": 3,
      "snoozeAllowed": true
    }
  },
  "rewards": {
    "xp": {
      "questClear": 20,
      "bossClear": 100,
      "solutionAssistedMultiplier": 0.5
    },
    "currency": {
      "name": "Shards",
      "bossClear": 1,
      "shopEnabled": false
    }
  },
  "validation": {
    "referenceMustPass": true,
    "linearScanShouldFailBudget": false,
    "requiredOutcomeFixtures": [
      "passed",
      "wrong_answer",
      "compile_error",
      "runtime_error",
      "over_budget",
      "loop_guard",
      "off_end_read"
    ],
    "maxTimelineEvents": 3000,
    "originalTextChecklist": {
      "noCopiedProblemStatement": true,
      "originalStory": true,
      "noRealGameCharactersArtLogosMapsOrUi": true
    },
    "visualQualityChecklist": {
      "lineMovementVisible": true,
      "pointerMovementVisible": true,
      "sceneMetaphorOriginal": true,
      "outcomeVisualsDistinct": true
    }
  }
}
