{
  "schemaVersion": "quest-pack.v0",
  "id": "plain-binary-search",
  "slug": "plain-binary-search",
  "title": "Plain Binary Search: Calm Hallway",
  "status": "validated",
  "metadata": {
    "displayName": "Plain Binary Search",
    "shortDescription": "Practice classic binary search in a calm sorted hallway.",
    "difficulty": "easy",
    "sourceInspiredBy": "Binary Search",
    "originalTextConfirmed": true,
    "authors": [
      "Eric Weng",
      "Hermes"
    ],
    "createdAt": "2026-10-01T00:00:00.000Z",
    "updatedAt": "2026-10-01T00:00:00.000Z"
  },
  "story": {
    "worldName": "Calm Hallway",
    "premise": "A sorted hallway hides a target relic.",
    "playerRole": "Pathfinder",
    "dataMetaphor": "rooms",
    "targetMetaphor": "relic",
    "readMetaphor": "peek",
    "victoryText": "The relic is found.",
    "failureText": "Replay the search window."
  },
  "concepts": [
    "binary_search"
  ],
  "runtime": {
    "language": "python",
    "signature": "class Solution:\n    def search(self, nums: List[int], target: int) -> int:",
    "entrypoint": "Solution().search",
    "importsAllowed": [],
    "timeLimitMs": 2000,
    "timelineEventCap": 3000
  },
  "scene": {
    "type": "array",
    "renderer": "array-doors-v0",
    "smallInputMode": "doors",
    "largeInputMode": "skyline",
    "visualTokens": {
      "read": "peek",
      "target": "relic"
    },
    "trackedVariables": [
      "l",
      "r",
      "mid",
      "target"
    ],
    "outcomeVisuals": {
      "passed": "gold_relic_glow",
      "wrong_answer": "red_wrong_room_green_expected",
      "compile_error": "broken_spell_scroll",
      "runtime_error": "spark_burst",
      "over_budget": "empty_meter",
      "loop_guard": "spinning_pathfinder",
      "off_end_read": "ghost_room_fall"
    }
  },
  "quests": [
    {
      "id": "binary-window",
      "order": 1,
      "title": "Quest 1: Hold the window",
      "brief": "Search a calm sorted hallway before harder timequakes.",
      "learningGoal": "Practice binary search boundaries.",
      "signature": "class Solution:\n    def search(self, nums: List[int], target: int) -> int:",
      "entrypoint": "Solution().search",
      "starterCode": "class Solution:\n    def search(self, nums: List[int], target: int) -> int:\n        pass\n",
      "hints": [
        {
          "id": "h1",
          "text": "Where should l and r start?",
          "cost": "free"
        }
      ],
      "solution": {
        "code": "class Solution:\n    def search(self, nums: List[int], target: int) -> int:\n        l = 0\n        r = len(nums) - 1\n        while l <= r:\n            mid = (l + r) // 2\n            if nums[mid] == target:\n                return mid\n            if nums[mid] < target:\n                l = mid + 1\n            else:\n                r = mid - 1\n        return -1\n",
        "explanation": "Cut the sorted hallway in half until target is found or absent.",
        "complexity": {
          "time": "O(log n)",
          "space": "O(1)"
        }
      },
      "tests": {
        "fixed": [
          {
            "id": "win-found",
            "input": {
              "nums": [
                1,
                3,
                5
              ],
              "target": 3
            },
            "expected": 1
          }
        ],
        "replayCaseIds": [
          "win-found"
        ]
      },
      "budget": {
        "enabled": true,
        "unit": "array_read",
        "formula": "4 * ceil(log2(n + 1)) + 16",
        "failureMode": "hard_fail"
      },
      "unlock": {
        "requiresQuestIds": [],
        "requiresPassed": true
      },
      "rewards": {
        "xp": 20
      }
    },
    {
      "id": "binary-missing",
      "order": 2,
      "title": "Quest 2: Prove absence",
      "brief": "Search a calm sorted hallway before harder timequakes.",
      "learningGoal": "Practice binary search boundaries.",
      "signature": "class Solution:\n    def search(self, nums: List[int], target: int) -> int:",
      "entrypoint": "Solution().search",
      "starterCode": "class Solution:\n    def search(self, nums: List[int], target: int) -> int:\n        pass\n",
      "hints": [
        {
          "id": "h1",
          "text": "Where should l and r start?",
          "cost": "free"
        }
      ],
      "solution": {
        "code": "class Solution:\n    def search(self, nums: List[int], target: int) -> int:\n        l = 0\n        r = len(nums) - 1\n        while l <= r:\n            mid = (l + r) // 2\n            if nums[mid] == target:\n                return mid\n            if nums[mid] < target:\n                l = mid + 1\n            else:\n                r = mid - 1\n        return -1\n",
        "explanation": "Cut the sorted hallway in half until target is found or absent.",
        "complexity": {
          "time": "O(log n)",
          "space": "O(1)"
        }
      },
      "tests": {
        "fixed": [
          {
            "id": "miss",
            "input": {
              "nums": [
                1,
                3,
                5,
                7
              ],
              "target": 2
            },
            "expected": -1
          }
        ],
        "replayCaseIds": [
          "miss"
        ]
      },
      "budget": {
        "enabled": true,
        "unit": "array_read",
        "formula": "4 * ceil(log2(n + 1)) + 16",
        "failureMode": "hard_fail"
      },
      "unlock": {
        "requiresQuestIds": [
          "binary-window"
        ],
        "requiresPassed": true
      },
      "rewards": {
        "xp": 20
      }
    }
  ],
  "boss": {
    "id": "boss-plain-binary-search",
    "order": 3,
    "title": "Boss: Calm Hallway Search",
    "brief": "Search a calm sorted hallway before harder timequakes.",
    "learningGoal": "Practice binary search boundaries.",
    "signature": "class Solution:\n    def search(self, nums: List[int], target: int) -> int:",
    "entrypoint": "Solution().search",
    "starterCode": "class Solution:\n    def search(self, nums: List[int], target: int) -> int:\n        pass\n",
    "hints": [
      {
        "id": "h1",
        "text": "Where should l and r start?",
        "cost": "free"
      }
    ],
    "solution": {
      "code": "class Solution:\n    def search(self, nums: List[int], target: int) -> int:\n        l = 0\n        r = len(nums) - 1\n        while l <= r:\n            mid = (l + r) // 2\n            if nums[mid] == target:\n                return mid\n            if nums[mid] < target:\n                l = mid + 1\n            else:\n                r = mid - 1\n        return -1\n",
      "explanation": "Cut the sorted hallway in half until target is found or absent.",
      "complexity": {
        "time": "O(log n)",
        "space": "O(1)"
      }
    },
    "tests": {
      "fixed": [
        {
          "id": "plain-boss",
          "input": {
            "nums": [
              1,
              2,
              3,
              4,
              5,
              6,
              7,
              8
            ],
            "target": 6
          },
          "expected": 5
        },
        {
          "id": "plain-missing",
          "input": {
            "nums": [
              1,
              2,
              3,
              4,
              5,
              6,
              7,
              8
            ],
            "target": 9
          },
          "expected": -1
        }
      ],
      "replayCaseIds": [
        "plain-boss"
      ]
    },
    "budget": {
      "enabled": true,
      "unit": "array_read",
      "formula": "4 * ceil(log2(n + 1)) + 16",
      "failureMode": "hard_fail"
    },
    "unlock": {
      "requiresQuestIds": [
        "binary-window",
        "binary-missing"
      ],
      "requiresPassed": true
    },
    "rewards": {
      "xp": 20
    }
  },
  "review": {
    "enabled": true,
    "defaultSchedule": [
      1,
      3,
      7,
      14,
      30
    ],
    "variants": [],
    "rules": {
      "failedReviewIntervalDays": 1,
      "solutionAssistedIntervalDays": 1,
      "heavyHintMaxIntervalDays": 3,
      "snoozeAllowed": true
    }
  },
  "rewards": {
    "xp": {
      "questClear": 20,
      "bossClear": 100,
      "solutionAssistedMultiplier": 0.5
    },
    "currency": {
      "name": "Shards",
      "bossClear": 1,
      "shopEnabled": false
    }
  },
  "validation": {
    "referenceMustPass": true,
    "linearScanShouldFailBudget": false,
    "requiredOutcomeFixtures": [
      "passed",
      "wrong_answer",
      "compile_error",
      "runtime_error",
      "over_budget",
      "loop_guard",
      "off_end_read"
    ],
    "maxTimelineEvents": 3000,
    "originalTextChecklist": {
      "noCopiedProblemStatement": true,
      "originalStory": true,
      "noRealGameCharactersArtLogosMapsOrUi": true
    },
    "visualQualityChecklist": {
      "lineMovementVisible": true,
      "pointerMovementVisible": false,
      "sceneMetaphorOriginal": true,
      "outcomeVisualsDistinct": true
    }
  }
}
