{
  "schemaVersion": "quest-pack.v0",
  "id": "linked-list-cycle",
  "slug": "linked-list-cycle",
  "title": "Linked List Cycle: Endless Portal",
  "status": "validated",
  "metadata": {
    "difficulty": "easy",
    "originalTextConfirmed": true,
    "authors": [
      "Eric Weng",
      "Hermes"
    ],
    "createdAt": "2026-10-01T00:00:00.000Z",
    "updatedAt": "2026-10-01T00:00:00.000Z",
    "displayName": "Linked List Cycle",
    "shortDescription": "Detect whether a portal chain loops forever.",
    "sourceInspiredBy": "Linked List Cycle: Endless Portal"
  },
  "story": {
    "worldName": "Portal Islands",
    "premise": "Each node is an island connected by one-way portals.",
    "playerRole": "Portal mapper",
    "dataMetaphor": "islands",
    "targetMetaphor": "target island",
    "readMetaphor": "portal check",
    "victoryText": "The island chain stabilizes.",
    "failureText": "The portals point somewhere unexpected. Replay the walk."
  },
  "concepts": [
    "linked_list",
    "two_pointers"
  ],
  "runtime": {
    "language": "python",
    "signature": "class Solution:\n    def hasCycle(self, head: Optional[ListNode]) -> bool:",
    "entrypoint": "Solution().hasCycle",
    "importsAllowed": [],
    "timeLimitMs": 2000,
    "timelineEventCap": 3000
  },
  "scene": {
    "type": "linked_list",
    "renderer": "linked-list-portals-v0",
    "smallInputMode": "islands",
    "largeInputMode": "portal-chain",
    "visualTokens": {
      "node": "island",
      "next": "portal",
      "read": "map-check"
    },
    "trackedVariables": [
      "head",
      "prev",
      "curr",
      "next",
      "slow",
      "fast",
      "list1",
      "list2"
    ],
    "outcomeVisuals": {
      "passed": "portal_chain_glow",
      "wrong_answer": "red_chain_green_expected",
      "compile_error": "broken_scroll",
      "runtime_error": "portal_sparks",
      "over_budget": "frayed_map_meter",
      "loop_guard": "endless_portal_spin",
      "off_end_read": "void_portal_fall"
    }
  },
  "quests": [
    {
      "id": "move-two-speeds",
      "order": 1,
      "title": "Quest 1: Move two scouts",
      "brief": "Return the first slow/fast values after one move.",
      "learningGoal": "Practice linked-list pointer movement.",
      "signature": "def first_step(head: Optional[ListNode]) -> List[int]:",
      "entrypoint": "first_step",
      "starterCode": "def first_step(head: Optional[ListNode]) -> List[int]:\n    pass\n",
      "hints": [
        {
          "id": "h1",
          "text": "Which pointer changes first?",
          "cost": "free"
        },
        {
          "id": "h2",
          "text": "What should be saved before rewiring next?",
          "cost": "reduces_reward"
        }
      ],
      "solution": {
        "code": "def first_step(head: Optional[ListNode]) -> List[int]:\n    slow = head.next\n    fast = head.next.next\n    return [slow.val, fast.val]\n",
        "explanation": "Walk the portal chain while keeping pointer state explicit.",
        "complexity": {
          "time": "O(n)",
          "space": "O(1)"
        }
      },
      "tests": {
        "fixed": [
          {
            "id": "step",
            "input": {
              "head": [
                3,
                2,
                0,
                -4
              ],
              "pos": -1
            },
            "expected": [
              2,
              0
            ]
          }
        ],
        "replayCaseIds": [
          "step"
        ]
      },
      "budget": {
        "enabled": false,
        "unit": "node_read",
        "failureMode": "badge_only"
      },
      "unlock": {
        "requiresQuestIds": [],
        "requiresPassed": true
      },
      "rewards": {
        "xp": 20
      }
    },
    {
      "id": "meet-check",
      "order": 2,
      "title": "Quest 2: Notice a meeting",
      "brief": "Return True when two pointers are same node.",
      "learningGoal": "Practice linked-list pointer movement.",
      "signature": "def same_node(head: Optional[ListNode]) -> bool:",
      "entrypoint": "same_node",
      "starterCode": "def same_node(head: Optional[ListNode]) -> bool:\n    pass\n",
      "hints": [
        {
          "id": "h1",
          "text": "Which pointer changes first?",
          "cost": "free"
        },
        {
          "id": "h2",
          "text": "What should be saved before rewiring next?",
          "cost": "reduces_reward"
        }
      ],
      "solution": {
        "code": "def same_node(head: Optional[ListNode]) -> bool:\n    marker = head.val\n    return head is head and marker == head.val\n",
        "explanation": "Walk the portal chain while keeping pointer state explicit.",
        "complexity": {
          "time": "O(n)",
          "space": "O(1)"
        }
      },
      "tests": {
        "fixed": [
          {
            "id": "same",
            "input": {
              "head": [
                1
              ],
              "pos": 0
            },
            "expected": true
          }
        ],
        "replayCaseIds": [
          "same"
        ]
      },
      "budget": {
        "enabled": false,
        "unit": "node_read",
        "failureMode": "badge_only"
      },
      "unlock": {
        "requiresQuestIds": [
          "move-two-speeds"
        ],
        "requiresPassed": true
      },
      "rewards": {
        "xp": 20
      }
    }
  ],
  "boss": {
    "id": "boss-linked-list-cycle",
    "order": 1,
    "title": "Boss: Detect the Endless Portal",
    "brief": "Detect whether portals loop forever.",
    "learningGoal": "Practice linked-list pointer movement.",
    "signature": "class Solution:\n    def hasCycle(self, head: Optional[ListNode]) -> bool:",
    "entrypoint": "Solution().hasCycle",
    "starterCode": "class Solution:\n    def hasCycle(self, head: Optional[ListNode]) -> bool:\n        pass\n",
    "hints": [
      {
        "id": "h1",
        "text": "Which pointer changes first?",
        "cost": "free"
      },
      {
        "id": "h2",
        "text": "What should be saved before rewiring next?",
        "cost": "reduces_reward"
      }
    ],
    "solution": {
      "code": "class Solution:\n    def hasCycle(self, head: Optional[ListNode]) -> bool:\n        slow = head\n        fast = head\n        while fast and fast.next:\n            slow = slow.next\n            fast = fast.next.next\n            if slow is fast:\n                return True\n        return False\n",
      "explanation": "Walk the portal chain while keeping pointer state explicit.",
      "complexity": {
        "time": "O(n)",
        "space": "O(1)"
      }
    },
    "tests": {
      "fixed": [
        {
          "id": "cycle-yes",
          "input": {
            "head": [
              3,
              2,
              0,
              -4
            ],
            "pos": 1
          },
          "expected": true
        },
        {
          "id": "cycle-no",
          "input": {
            "head": [
              1,
              2
            ],
            "pos": -1
          },
          "expected": false
        }
      ],
      "replayCaseIds": [
        "cycle-yes"
      ]
    },
    "budget": {
      "enabled": false,
      "unit": "node_read",
      "failureMode": "badge_only"
    },
    "unlock": {
      "requiresQuestIds": [
        "move-two-speeds",
        "meet-check"
      ],
      "requiresPassed": true
    },
    "rewards": {
      "xp": 20
    }
  },
  "review": {
    "enabled": true,
    "defaultSchedule": [
      1,
      3,
      7,
      14,
      30
    ],
    "variants": [
      {
        "id": "review-linked-list-cycle-core",
        "title": "Review: Boss: Detect the Endless Portal",
        "mutation": "Repeat the boss pattern with a saved review case to reinforce recall.",
        "tests": {
          "fixed": [
            {
              "id": "cycle-yes",
              "input": {
                "head": [
                  3,
                  2,
                  0,
                  -4
                ],
                "pos": 1
              },
              "expected": true
            }
          ],
          "replayCaseIds": [
            "cycle-yes"
          ]
        }
      }
    ],
    "rules": {
      "failedReviewIntervalDays": 1,
      "solutionAssistedIntervalDays": 1,
      "heavyHintMaxIntervalDays": 3,
      "snoozeAllowed": true
    }
  },
  "rewards": {
    "xp": {
      "questClear": 20,
      "bossClear": 100,
      "solutionAssistedMultiplier": 0.5
    },
    "currency": {
      "name": "Shards",
      "bossClear": 1,
      "shopEnabled": false
    }
  },
  "validation": {
    "referenceMustPass": true,
    "linearScanShouldFailBudget": false,
    "requiredOutcomeFixtures": [
      "passed",
      "wrong_answer",
      "compile_error",
      "runtime_error",
      "over_budget",
      "loop_guard",
      "off_end_read"
    ],
    "maxTimelineEvents": 3000,
    "originalTextChecklist": {
      "noCopiedProblemStatement": true,
      "originalStory": true,
      "noRealGameCharactersArtLogosMapsOrUi": true
    },
    "visualQualityChecklist": {
      "lineMovementVisible": true,
      "pointerMovementVisible": true,
      "sceneMetaphorOriginal": true,
      "outcomeVisualsDistinct": true
    }
  }
}
